{
  "$schema": "./brand-config.schema.json",
  "name": "Default Neutral",
  "description": "Achromatic neutral baseline with subtle rounded corners and soft shadows.",
  "colors": {
    "light": {
      "background": "oklch(1 0 0)",
      "foreground": "oklch(0.145 0 0)",
      "card": "oklch(1 0 0)",
      "cardForeground": "oklch(0.145 0 0)",
      "popover": "oklch(1 0 0)",
      "popoverForeground": "oklch(0.145 0 0)",
      "primary": "oklch(0.205 0 0)",
      "primaryForeground": "oklch(0.985 0 0)",
      "secondary": "oklch(0.97 0 0)",
      "secondaryForeground": "oklch(0.205 0 0)",
      "muted": "oklch(0.97 0 0)",
      "mutedForeground": "oklch(0.556 0 0)",
      "accent": "oklch(0.97 0 0)",
      "accentForeground": "oklch(0.205 0 0)",
      "destructive": "oklch(0.577 0.245 27.325)",
      "border": "oklch(0.922 0 0)",
      "input": "oklch(0.922 0 0)",
      "ring": "oklch(0.708 0 0)",
      "overlay": "oklch(0 0 0 / 80%)",
      "sidebar": "oklch(0.985 0 0)",
      "sidebarForeground": "oklch(0.145 0 0)",
      "sidebarBorder": "oklch(0.922 0 0)",
      "sidebarAccent": "oklch(0.97 0 0)",
      "sidebarAccentForeground": "oklch(0.205 0 0)",
      "sidebarRing": "oklch(0.708 0 0)",
      "chart1": "oklch(0.646 0.222 41.116)",
      "chart2": "oklch(0.6 0.118 184.714)",
      "chart3": "oklch(0.398 0.07 227.392)",
      "chart4": "oklch(0.828 0.189 84.429)",
      "chart5": "oklch(0.769 0.188 70.08)"
    },
    "dark": {
      "background": "oklch(0.145 0 0)",
      "foreground": "oklch(0.985 0 0)",
      "card": "oklch(0.205 0 0)",
      "cardForeground": "oklch(0.985 0 0)",
      "popover": "oklch(0.205 0 0)",
      "popoverForeground": "oklch(0.985 0 0)",
      "primary": "oklch(0.922 0 0)",
      "primaryForeground": "oklch(0.205 0 0)",
      "secondary": "oklch(0.269 0 0)",
      "secondaryForeground": "oklch(0.985 0 0)",
      "muted": "oklch(0.269 0 0)",
      "mutedForeground": "oklch(0.708 0 0)",
      "accent": "oklch(0.269 0 0)",
      "accentForeground": "oklch(0.985 0 0)",
      "destructive": "oklch(0.704 0.191 22.216)",
      "border": "oklch(1 0 0 / 10%)",
      "input": "oklch(1 0 0 / 15%)",
      "ring": "oklch(0.556 0 0)",
      "overlay": "oklch(0 0 0 / 85%)",
      "sidebar": "oklch(0.175 0 0)",
      "sidebarForeground": "oklch(0.985 0 0)",
      "sidebarBorder": "oklch(1 0 0 / 10%)",
      "sidebarAccent": "oklch(0.269 0 0)",
      "sidebarAccentForeground": "oklch(0.985 0 0)",
      "sidebarRing": "oklch(0.556 0 0)",
      "chart1": "oklch(0.488 0.243 264.376)",
      "chart2": "oklch(0.696 0.17 162.48)",
      "chart3": "oklch(0.769 0.188 70.08)",
      "chart4": "oklch(0.627 0.265 303.9)",
      "chart5": "oklch(0.645 0.246 16.439)"
    }
  },
  "shape": {
    "radius": "0.625rem",
    "borderWidth": "1px",
    "shadow": {
      "sm": "0 1px 2px oklch(0 0 0 / 5%)",
      "md": "0 4px 6px oklch(0 0 0 / 7%)",
      "lg": "0 10px 15px oklch(0 0 0 / 10%)"
    }
  },
  "typography": {
    "fontWeightNormal": "400",
    "fontWeightMedium": "500",
    "fontWeightBold": "700",
    "letterSpacing": "0em",
    "lineHeight": "1.5"
  },
  "motion": {
    "transitionDuration": "150ms",
    "transitionTimingFn": "cubic-bezier(0.4, 0, 0.2, 1)"
  }
}
